{
  "$schema":"https://json-schema.org/draft/2020-12/schema",
  "title":"AI Market package metadata (not an MCP protocol)",
  "type":"object",
  "required":["schemaVersion","id","version","name","description","license","skills","mcpServers","dependencies"],
  "properties":{
    "schemaVersion":{"const":1},
    "id":{"type":"string","pattern":"^[a-z][a-z0-9-]*$"},
    "version":{"type":"string","pattern":"^[0-9]+\\.[0-9]+\\.[0-9]+$"},
    "name":{"type":"string","minLength":1},
    "description":{"type":"string"},
    "license":{"type":"string"},
    "skills":{"type":"array","items":{"type":"string"}},
    "mcpServers":{"type":"object"},
    "dependencies":{"type":"object"},
    "hostAdapters":{"type":"object"}
  },
  "additionalProperties":true
}
